{
    "info": {
        "version": 0
    },
    "param_types": [
        {
            "key": "type",
            "value": "API",
            "params": [
                {
                    "param": "api",
                    "id": "scmi_perms",
                    "category": "API"
                },
                {
                    "param": "test",
                    "id": "scmi_unit_test",
                    "category": "API"
                }
            ],
            "param_types": [
                {
                    "key": "api",
                    "value": "CPU",
                    "params": [
                        {
                            "param": "sema",
                            "id": "semaphore",
                            "category": "DEVICE"
                        }
                    ]
                },
                {
                    "key": "api",
                    "value": "FAULT",
                    "params": [
                        {
                            "param": "reaction",
                            "id": "lmm_react_types",
                            "category": "FAULTS"
                        }
                    ]
                }
            ]
        },
        {
            "key": "type",
            "value": "MDAC",
            "params": [
                {
                    "param": "sa",
                    "json_file": "soc_model",
                    "id": "sa",
                    "category": "MDAC"
                },
                {
                    "param": "sid",
                    "json_file": "soc_model",
                    "id": "sid",
                    "category": "MDAC"
                },
                {
                    "param": "mdid",
                    "json_file": "soc_model",
                    "id": "mdid",
                    "category": "MDAC"
                },
                {
                    "param": "kpa",
                    "json_file": "soc_model",
                    "id": "kpa",
                    "category": "MDAC"
                }
            ],
            "infos": [
                {
                    "key": "trdc",
                    "label": "TRDC Letter",
                    "description": "TRDC Letter of the MDAC (Master Domain Assignment Controller)"
                },
                {
                    "key": "master",
                    "label": "MDAC Number",
                    "description": "Number of the Bus Master"
                },
                {
                    "key": "core",
                    "label": "Bus Master Type",
                    "description": "Type of the Bus Master to handle data transactions - Core/Processor (1) or Non-Core/Non-processor (0) Bus Master"
                }
            ],
            "param_types": [
                {
                    "key": "core",
                    "value": "0",
                    "params": [
                        {
                            "param": "pa",
                            "json_file": "soc_model",
                            "id": "pa",
                            "category": "MDAC"
                        }
                    ]
                }
            ]
        },
        {
            "key": "type",
            "value": "MBC",
            "params": [
                {
                    "param": "perm",
                    "json_file": "soc_model",
                    "id": "access_templates",
                    "category": "MBC/MRC"
                },
                {
                    "param": "dom_clr_unused",
                    "json_file": "soc_model",
                    "id": "dom_clr_unused",
                    "category": "MBC/MRC"
                },
                {
                    "param": "dom_exclusive",
                    "json_file": "soc_model",
                    "id": "dom_exclusive",
                    "category": "MBC/MRC"
                }
            ],
            "infos": [
                {
                    "key": "trdc",
                    "label": "TRDC Letter",
                    "description": "TRDC Letter of the MBC (Memory Block Checker)"
                },
                {
                    "key": "mbc",
                    "label": "MBC Number",
                    "description": "Memory Block Checker instance number"
                },
                {
                    "key": "mem",
                    "label": "MBC Memory Region",
                    "description": "Memory Block Checker's Region number"
                }
            ],
            "param_types": [
                {
                    "key": "write_type",
                    "value": "mem",
                    "params": [
                        {
                            "param": "begin",
                            "json_file": "soc_model",
                            "id": "begin",
                            "category": "MBC/MRC"
                        },
                        {
                            "param": "size",
                            "json_file": "soc_model",
                            "id": "size",
                            "category": "MBC/MRC"
                        }
                    ]
                },
                {
                    "key": "write_type",
                    "value": "block",
                    "params": [],
                    "infos": [
                        {
                            "key": "blk",
                            "label": "Block Number",
                            "description": "Block number identifies unique segment of the memory."
                        }
                    ]
                },
                {
                    "key": "write_type",
                    "value": "range",
                    "params": [],
                    "infos": [
                        {
                            "key": "blk",
                            "label": "Start Block Number",
                            "description": "Block number identifies unique segment of the memory start address."
                        },
                        {
                            "key": "bcnt",
                            "label": "Block Count",
                            "description": "Number of memory blocks assigned"
                        }
                    ]
                }
            ]
        },
        {
            "key": "type",
            "value": "MRC",
            "params": [
                {
                    "param": "perm",
                    "json_file": "soc_model",
                    "id": "access_templates",
                    "category": "MBC/MRC"
                },
                {
                    "param": "nodbg",
                    "json_file": "soc_model",
                    "id": "nodbg",
                    "category": "MRC DEBUG"
                },
                {
                    "param": "begin",
                    "json_file": "soc_model",
                    "id": "begin",
                    "category": "MBC/MRC"
                },
                {
                    "param": "size",
                    "json_file": "soc_model",
                    "id": "size",
                    "category": "MBC/MRC"
                },
                {
                    "param": "clr",
                    "json_file": "soc_model",
                    "id": "clr",
                    "category": "MBC/MRC"
                },
                {
                    "param": "dom_clr_unused",
                    "json_file": "soc_model",
                    "id": "dom_clr_unused",
                    "category": "MBC/MRC"
                },
                {
                    "param": "dom_exclusive",
                    "json_file": "soc_model",
                    "id": "dom_exclusive",
                    "category": "MBC/MRC"
                }
            ],
            "infos": [
                {
                    "key": "trdc",
                    "label": "TRDC letter",
                    "description": "TRDC Letter of the MRC (Memory Region Checker)"
                },
                {
                    "key": "mrc",
                    "label": "MRC number",
                    "description": "MRC instance number"
                }
            ]
        },
        {
            "key": "type",
            "value": "BCTRL_IPG_DEBUG",
            "params": [],
            "infos": [
                {
                    "key": "bctrl",
                    "label": "BCTRL name",
                    "description": "Block Control Name Letter"
                },
                {
                    "key": "regn",
                    "label": "BCTRL register number",
                    "description": "Block Control Register number to enable IPG debug halted mode"
                },
                {
                    "key": "mask",
                    "label": "BCTRL mask",
                    "description": "Block Control mask to enable IPG debug halted mode"
                }
            ]
        }
    ],
    "protocols": {
        "label": "Protocols",
        "description": "System Manager API protocols",
        "items": [
            {
                "id": "base",
                "label": "Agent Base",
                "description": "Agent used to configure base protocol access to agents",
                "prefix": "BASE",
                "test": "TEST_BASE",
                "static": true
            },
            {
                "id": "pd",
                "label": "Power Domain",
                "description": "Device/board power domain",
                "prefix": "PD",
                "test": "TEST_PD",
                "static": false
            },
            {
                "id": "sys",
                "label": "System Power Protocol",